《最强大脑》首播闯入60强 内蒙古大学王梦涵美貌与智慧并存,http://www.nmgcb.com.cn/renwu/2019/0220/192113.html
2019内蒙古大学考研初试查分入口及方式,http://kaoyan.xdf.cn/201902/10852111.html
中央部省合建支持中西部地区14所高等学校发展,http://edu.sina.com.cn/gaokao/2019-02-25/doc-ihsxncvf7570256.shtml
云上北疆中国数谷 大数据在内蒙古引发全新变革,http://www.ec.com.cn/article/qyds/nmg/201902/37534_1.html
人勤春来早 乌审旗奋进开好局,http://www.northnews.cn/2019/0225/3033617.shtml
2018国家奖学金获奖学生代表名录(获奖名单照片+资料),http://m.mnw.cn/edu/news/2131492.html
内蒙古国家大数据综合试验区 探索创新结硕果,http://www.legaldaily.com.cn/IT/content/2019-02/25/content_7778450.htm
去年约5万名本专科学生获国家奖学金 百名优秀代表公布,http://edu.youth.cn/jyzx/jyxw/201902/t20190225_11878619.htm
云上北疆 中国数谷,http://news.enorth.com.cn/system/2019/02/25/036886632.shtml
人大代表、政协委员点赞公安机关交通管理服务工作,http://www.thepaper.cn/newsDetail_forward_3032586
云师大商学院开学第一件暖心事,http://www.mbachina.com/html/cjxw/201902/181630.html
呼和浩特市人民检察院工作报告,http://nm.people.com.cn/n2/2019/0222/c347185-32670421.html
点赞!海大教师王联春荣获东方市“十大好人”称号,http://www.mbachina.com/html/hainu/20190225/181577.html
陆雄文:商业领袖的三个特质- MBA中国网,http://www.mbachina.com/html/fudan/20190225/181472.html
"著名元史学者洪金富、赵琦夫妇在家中去世,疑因一氧化碳中毒",http://news.sina.com.cn/o/2019-02-20/doc-ihqfskcp7008098.shtml
沈阳播音与主持考前培训中心_汇声教育_价格费用_哪里好_多少钱-...,https://www.eol.cn/peixun/j_e2726/0_e1afd0.html
加快推进县级融媒体中心建设,http://www.xinhuanet.com/zgjx/2019-02/19/c_137833053.htm
内蒙古大学,https://souky.eol.cn/news/takeinfo/313/48137.html
内蒙古大学:时间都去哪了?这次内大人来告诉你,http://www.mbachina.com/html/imu/201812/176323.html
内蒙古大学经济管理学院,http://www.mbachina.com/colleges/imu/?page=1
内蒙古大学2018年各省市各批次录取分数线,http://www.gaokao.com/e/20180801/5b61bc7a355ce.shtml
内蒙古大学2018年招生章程,http://www.gx211.com/news/20180626/n15299742903164.html
2018内蒙古大学全国统一考试硕士研究生招收拟录名单公示,http://www.eoffcn.com/kszx/zcfg/599893.html
内蒙古大学化学化工学院刘国都课题组2018年考研调剂信息公布,http://bj.offcn.com/html/2018/03/118594.html
"2018内蒙古自治区大学排名,内蒙古大学第一",http://learning.sohu.com/20180305/n528533927.shtml
内蒙古大学2018MBA管理类联考考研成绩查询入口,http://www.mbachina.com/html/sxyxw/201802/118033.html
内蒙古大学2018考研成绩查询系统于本周六9点开放,http://www.kaoyan365.cn/dongtai/126063.html
2018年内蒙古大学工商管理硕士MBA招生简章,http://www.hqwx.com/web_news/html/2017-11/15096143681216.html
2017年内蒙古大学录取分数线,http://www.gaokao.com/e/20170707/595f31142fe67.shtml
内蒙古大学2017年运动训练专业招生简章,https://gaokao.chsi.com.cn/gkxx/tylzs/zsjz/201703/20170309/1589522714.html
内蒙古大学附属中学9月26日开工奠基(图),http://news.163.com/13/1010/11/9AQQANJ900014Q4P.html
内蒙古大学:优秀教师,https://edu.qq.com/a/20130524/008940_all.htm
杨贵明笔下的炫彩内蒙古,http://m.sohu.com/a/296579302_100126774
2019调剂| 新闻传播考研最新最全调剂攻略,http://m.sohu.com/a/296208352_497719/
内蒙古大学博士生导师李前忠教授简介,http://www.cnky.net/dxk/daoshi-10126-5055.html
内蒙古大学2017年会计硕士MPAcc招生简章,http://www.mbachina.com/html/mpacczs/201609/97967.html
国家奖学金获奖学生代表名录,http://jl.people.com.cn/n2/2019/0225/c349771-32677446-2.html
内蒙古大学2018年招生章程及招生计划,http://365jia.cn/news/2018-06-19/54C2EA94713FBC41.html
2017内蒙古大学综合实力排行 内蒙古大学第一,https://edu.qq.com/a/20170109/019466.htm
中办国办文件:部省合建支持中西部14所高校发展,http://news.sina.com.cn/o/2019-02-24/doc-ihqfskcp8200893.shtml
元史学者洪金富赵琦夫妇去世 疑因一氧化碳中毒,http://news.sina.com.cn/o/2019-02-20/doc-ihqfskcp7004436.shtml
"武汉大学经管院:冬日珞珈多妖娆,淡淡梅花香欲染",http://www.mbachina.com/html/whu/201902/181668.html
云上北疆 中国数谷 内蒙古国家大数据综合试验区探索创新结硕果,http://nm.people.com.cn/n2/2019/0225/c196820-32678580.html
教育部公布国家奖学金名单 海南两名学生上榜,http://hi.people.com.cn/n2/2019/0225/c231190-32676828.html
国家奖学金获奖学生代表名录,http://news.enorth.com.cn/system/2019/02/25/036886628.shtml
去年约5万名本专科学生获国家奖学金 两名安徽高校优秀代表,http://ah.ifeng.com/a/20190225/7233980_0.shtml
"去年约5万名本专科学生获国家奖学金,百名优秀代表公布",http://china.huanqiu.com/article/2019-02/14398189.html
去年约5万大学生获国家奖学金 百名优秀代表公布,http://news.sina.com.cn/s/2019-02-25/doc-ihqfskcp8254531.shtml
以改革创新守护路畅人安 全国人大代表、政协委员点赞公安机关交通...,http://news.cnr.cn/native/gd/20190224/t20190224_524520175.shtml
